basic,daesang,basic1,unse,cash,love,marriage,health,business,trade,miss,travel,wish,employ,school,weather,name,idx
"[정]이란 세발 달린 무쇠솥을 말한다.
삶고 익히는 그릇이다. 3개의 다리로 세워져 있다. 신령에게 바치는 공물을 끓이는 제사그릇으로 또한 국가 권위의 상징이기도 했다. 권위를 의심한다는 것을 세발달린 솥의 경중을 묻는다는 말로 나타내는 것도 여기에서 온 말이다. 세개의 다리는 협력과 안정을 나타낸다. 세점은 한 평면을 결정하며 세 다리는 가장 안전성이 있는 것이다. 세사람이 힘을 모아 무거운 짐을 드는 형상이다. 개인으로서는 이른바 삼박자가 가지런히 된 형상으로 무슨 일에나 순조로운 진전을 나타내는 괘이다. 남녀 관계에서는 삼각 관계를 나타내는데 그것도 원만히 수습되는 것이다. 끝까지 협력관계를 잃지 않는 것이 긴요하다.

정은 크게 뻗어 발전하는 것이다. 이 괘는 무쇠 솥을 상징하고 있다. 나무를 불속에 넣어서 삶고 익힌다. 성천자는 이렇게 조리한 공물을 바쳐서 천제를 제사하고 천하의 현자들에게 향연을 베푼다. 겸손하고 총명해서 남의 말과 의견을 존중한다. 유(부드러운)효가 천자의 자리에 있어서 강(강한)효와 서로 응하고 있다. 그런 까닭으로 크게 뻗어 발전한다.","나무에 불이 붙어 타오른다. 이것이 정의 괘상이다. 군자는 이 괘상을 보고 질서를 정비하고 주어진 천명을 성취하는 것이다.","[정]이란 발이 셋 달린 무쇠솥을 의미한다.
물건을 받치고 있다는 뜻이다. 세개의 발은 협력과 안정을 가리키고 있다. 왕과 제후와 어진 신하가 잔치를 베풀고 즐겁게 담소하고 서로 의견을 나누는 모습이다. 정담, 정립이라는 말은 여기에서 나왔다.","이 괘는 안정감과 충실감이 있는 상태를 나타내고 있다. 재력, 지력, 기반을 세박자가 잘 조화되어서 무슨 일에나 행동의 자유를 가질 때이다.
무슨 일이나 혼자 해서는 안된다. 남의 힘을 빌려서 서로 이익을 나누는 아량을 지녀야 한다. 결코 자기 혼자서 하려는 독단주의 이기주의는 실패하고 만다.","넉넉할 때다. 자금을 원활히 융통시키야 한다. 금전을 쓰지 않고 사장시켜 놓는 일은 금물이다.","서로가 좋은 상대를 얻을 수 있을 때이다. 대개 남성은 수려하고 여성은 이지적일 때가 많다. 성격상으로 잘 융화된다. 적극적으로 밀고 나갈것.","아주 길하다(훌륭하다). 혼담도 원만하게 진행된다. 그러나 결혼후 제 2의 이성이 나타나기 쉬우니 주의해야 한다.","병은 전염성과 유행성이 많은 때다. 몸이 약한 사람은 호홉기 질환이나 장질환에 주의하도록","사업의 근본이 변하지는 않는다. 내용을 새롭게 하고 외견을 미화하는 것이 중요하다. 또한 취급 품목을 변경해 보거나 새로운 거래처를 터 보는 것이 좋다. 특히 자금관계는 협력자가 나타나여 좋아진다. 샐러리맨은 지위가 승진할 때이다.","상대의 입장을 생각하고 성실하게 융화책을 쓰는 것이 성공의 기회를 만들어 준다. 그리고 자기의 입장이 약하다는 것을 항상 염두에 둘 것.","적은 물건을 잃었을 경우 찾기가 힘들다. 그러나 금속성의 물건이나 부피가 큰 것은 곧 찾아내게 된다.","돈에 부자유를 느끼지 않는 즐거운 여행을 한다. 여러 사람이 클럽을 지어가는 단체 여행을 하기도 좋은 때이다. 이사를 해도 좋은 집을 얻게된다. 비싸게 산 집이라도 고가로 다시 팔리게 된다.","자기만 행복해지는 것이 아니고 상대를 행복하게 해 줌으로서 자기도 행복하게 되는 것이다. 그런 후 실력자를 구해서 그 사람의 의견을 따라 실행하면 자기의 목적은 달성된다.","결정이 날 때다. 그러나 자리가 마음에 들지 않는다고 포기하지 말아라. 곧 인정을 받아 승진을 얻을 것이다.","공립학교보다는 사립의 명문학교를 선택하도록. 경제나 상과를 전공하는 것이 좋다.","맑다 바람이 약간 있다. 비가 올 때 이 괘가 나오면 곧 바람이 불면서 개인다.","화풍정(火風鼎)","50"
"[쾌]란 타개한다, 중대사를 결행하다는 뜻이다. 제일 위에 음효가 있고 다섯개의 양효를 억압하고 있다. 독재자가 세론을 무시하고 학정을 펴고 있는 형상이다. 위험은 따르겠으나 비상수단에 호소해서라도 이 독재자를 배제하지 않으면 안 된다. 강건한 정신으로 그것을 행함으로서만이 사람들은 즐거워하고 화평해지는 것이다. 거기에는 불순한 동기가 있어서는 안된다. 사리사욕을 떠나 정의를 관찰해 갈 것, 또한 자기 기반을 굳게 닦고 실행 할것, 폭력은 가급적 피하는 것이 중요하다.

[쾌]라는 것은 결행한다. 타개한다는 뜻이다. 다섯개의 강효가 위에 있는 유효를 배제라는 것이다. 굳세고 의적한 정신으로 소인을 배제한다면 상하가 다 같이 기뻐하고 화목하게 되는 것이다. 권세를 휘두르는 간신을 처벌하는데는 조정에서 정의를 선양하고 성의를 다하여 사람들에게 호소하여야 한다. 물론 위험을 각오하지 않으면 안 된다. 자계(自戒)해야만 큰 성과도 약속된다. 먼저 자기의 영지(領地)를 다스려 놓은 다음에 결행하도록 하라. 그러나 무력을 써서는 안 된다. 자기가 지키고 있는 정의의 권위를 떨어뜨리게 될지도 모른다. 정의를 관철하고 그 도를 완성시키기 위하여 확고하게 [쾌]를 행함이 좋다.","연못이 하늘에 있다. 이것이 [쾌]의 괘상이다. 천상에 있는 연못의 물은 출구만 있으면 만물을 적신다. 군자는 이 괘상을 보고 아랫사람에게 은덕을 베풀고 사리사욕을 탐하는 일을 깊이 삼가한다.","[쾌]는 결의, 결단, 결정의 괘에 해당된다.
중대한 일을 결정함을 의미한다. [왕의 조정에 올린다]라는 말은 법정에서 올바른 의견을 주장한다는 뜻이다. 아무리 부정한 것에 대해서도 무력을 사용해서는 안 된다. 공명정대하게 이론으로 설득해서 만사를 순조롭게 이끌어 가야 한다.","[쾌]는 중대한 일을 결의, 결단 한다는 것이다. 너무 세력이 강하고 일고 나가는 힘이 넘쳐 있어서 도리어 겸손한 행위로 인해 실패를 초래하기 쉽다. 다시 말하면 여러가지 사업에 손을 대고 분수에 넘친 일에 마음을 두게되고 성급하게 일을 처리하려고 하는 폐단이 생긴다. 균형이 잘 안 맞고 한쪽으로 기울기 쉽다. 
스스로 자계하는 힘도 길러야 한다. [튼튼한 제방도 개미구멍으로 무너진다] 라는 말처럼 위험을 지니고 있는 호운이라는 것을 명심해야 한다. 지금 물이 넘쳐 있어서 뚝이 무너질 직전에 놓여 있는 상태다.","지금 돈의 운세는 좋을 때다. 어느정도까지 돈을 모았으니 너무 욕심을 부리지 말것. 
지금 운세의 정점에 달했기 때문에 그 싱상 구한다는 것은 나쁜 결과를 초래케 한다. 
주위 사람으로부터 미움을 받지 않도록 주의해서 처신해야 한다. 자기의 이익만을 생각지 말고 상대의 입장을 돌봐주는 것도 자기 이익추구의 한 방편임을 알아야 한다.","연애에도 여러가지 특수한 형이 있을 때다. 일방적으로 열을 올리는 결정적인형, 유부녀를 사랑하는 사연, 이런 연애는 경우에 따라 몸을 망치기 쉽다. 조심해야 할 때다.","물론 좋은 연분이 되지 못한다. 결혼한 부부는 금실이 좋지 않아 이혼을 논의할 때다.
혼약을 맺은 사이에는 파탄이 일어난다. 출산할 여자는 내일이 아니면 일주일후에 분만을 하게 된다.","호홉기 계통의 질환, 구토, 변비, 부종, 머리의 외상에 주의해야 한다. 이 괘에는 병세가 강할 때이다.","사업방침도 운세에 맡겨 밀고 나아가면 실패가 따르기 때문에 일단 목적과 계획만을 세우고 한 걸음 물러나는 편이 좋다. 운세를 가름하고 때를 기다리는 것이다.","너무 강제로 밀고 나가면 상대편에서 주춤하고 물러난다. 상대가 응해 올때까지 조용히 기다리는 편이 좋다. 가만히 있어도 상대는 이쪽의 운세에 끌려오기 마련이다.","대개는 망가져 있는 경우가 많다. 실내에서 없어진 물건은 높은 장소를 찾아보라.","이 괘의 경우 모두 중단하는 것이 좋다.","약간 무리다. 한번 기회를 놓쳤으니 다시 때를 기다려야 한다. 무리해서 나아가면 스스로 상처를 입을 것이다.","지금까지 닦은 실력을 발휘할 때다. 경쟁율이 아주 심하지만 그대신 가능성도 큰 경우가 있다. 자신을 잃지 말아여 한다.","희망한 학교에 합격할 수 있다. 투지와 정열로서 밀고 나가라.","당장이라도 비가 내릴듯한 흐린 날씨다. 호우가 쏟아질 때는 방파제나 제방이 무너질 염려가 있다. 또한 집중호우도 있을 것이다.","택천쾌(澤天쾌)","43"
"[구]라는 것은 해후의 후(逅)와 같은 뜻으로 우연이 만난다는 것이다. 택천쾌(澤天쾌)의 괘에서 소인의 세력을 몰아내고 평화스러운 시대가 찾아 왔다고 생각했을 때 뜻하지 않던 곳에서 재화를 만나게 된다는 것을 의미한다. 괘의 형상은 한개의 음효가 다섯개의 양효를 싣고 있는데, 마치 한 여자가 다섯남자를 상대하고 있는 형상이다. 물장사를 한 여자라도 상당한 솜씨를 가진여자이다. 그런 방면에서는 좋은 쾌지만 결혼상대로서는 마땅치 않다. [아내로 맞는 여자로는 상대하지 말라]는 것이다. 그건 그렇고 이 괘를 나쁜 면에서만 생각해서는 안 된다. 우연의 만남은 아름다운 인간의 모습을 만들기도 한다.

[구]는 만난다는 뜻이다.
한개의 유(부드러움)가 다섯 강(강함)을 만나는 형상이다. 많은 남자들 사이에 한 여자가 나타나서 남자들을 매혹하는 광경인 것이다. 여자는 거센 팔자를 지닌다. 이런 여자를 처로 삼아서는 안된다. 도저히 같이 살아 갈 수가 없는 것이다.
천지가 서로 만나면 만물은 모두 아름답게 자라고 강건한 것이 중정의 천자를 만나면 천하에 도가 행하여진다. [구]의 뜻은 참으로 중대한 것이다.","하늘 아래에 바람이 분다. 이것이 [구]의 괘상이다. 군주는 이 괘상을 보고 널리 정령을 시행하며 천하에 알리는 것이다.","[구]란 만난다는 것이다.
예를 갖추지 않고 우연히 만난다는 뜻을 지니고 있다. 해후의 후(逅)와 같은 것이다. 한 여자가 많은 남성에게(다섯명정도) 맞서고 있다는 것은 여자의 세력이 강력한 것을 의미하고 있다. 이와 같은 여성은 가정적이라 할 수 없다. 상당한 활동력을 가진 여자로서 돈을 모으는 형이다.","[구]는 우연히 만나다는 뜻이다.
이런 의미에서 여러가지로 괘풀이를 할 수 있다. 운세는 그리 좋은 편이 못된다. 나쁜면에서는 사기를 당하거나 재난을 맞는다. 큰 바람에 지붕이 날아가는 등 불상사를 당한다.
목적이 너무 많아서 마음은 바람처럼 불어 닥쳐서 주체하지 못할 때다. 목표를 분명히 세우지 못하고 우왕좌왕하다가 사기를 당하거나 손실을 입을 뿐만 아니라 특히 여자 때문에 실패가 많을 때다. 상대의 여자가 나쁜 것이 아니라 이쪽편에서 미혹되기 때문에 몸을 망치는 것이다.
또한 집안에서는 여자들의 세력이 강해서 골치를 않을 때다. 이런 때 달콤한 말로 꾀는 사람을 조심하라. 옛사람은 [봉황새가 앵무새를 만나는 꼴]이라고 했다. 전설에 나오는 봉황새가 앵무새를 만난다는 것은 생각할 수 없는 일인데, 이는 뜻하지 않는 사람을 만난다는 뜻을 나타내고 있다. 또 한가지는 비천한 여자가 귀인을 만난다는 뜻이 된다.","돈이 들어와도 소비를 당하지 못한다. 돈을 사기당하기 쉬울 때이니 조심하도록.","아기자기한 연애는 되지 못 한다. 서로가 순수한 마음으로 대하지 못하고 자기 이익과 향락위주로만 생각한다. 여자는 너무 인기가 높아서 남성들간에 참된 애정을 얻지 못한다.","물론 좋지 않다. 결혼을 한다해도 오래 계속되지 못 한다. 서로간에 마음의 안식처를 얻지 못하고 있기 때문이다.","전염성 질환, 성병, 섹스의 과중으로 몸이 피로해 있을 때다. 혹은 두통, 뇌일혈, 식욕부진, 치질, 항문병에 주의해야 한다.","무턱대고 나아갈 것이 아니다. 현재의 상태를 어떻게 굳게 지켜갈 것인가를 곰곰히 생각할 때이다. 자기 본직 이외의 다른 일에 권유를 받기도 한다. 그러나 함부로 덤볐다가는 지금의 자리도 잃는 큰 궁지에 몰리게 된다.","진행중에 뜻하지 않은 일이 생기곤 해서 골치를 앓는다. 일이 잘 풀지 않는다. 교재비로 돈을 많이 쓰게 된다. 그러나 너무 서두르거나 앞으로 나아가려고 해서는 안된다. 그러나 뜻하지 않은 유력자의 도움으로 기회가 생기는 수가 있다. 뜻밖의 일이라는 점에서 심사숙고하고 챤스를 붙잡아라.","집안에서 잃은 물건이 많다. 찾아보면 발견된다. 밖에서 잃은 물건은 잃은 곳을 알면 즉시 그 장소를 찾아가라. 그대로 있을 것이다. 혹은 사람이 주었을지라도 분실물센타 같은 곳에 가서 찾으면 물건이 보관되어 있을 것이다.","여행은 좋지 않다. 그러나 동행하는 여자가 있는 가벼운 여행정도는 탈이 없다.
이전이나 이사는 생각이 있어도 때가 나쁘니 중지하라.","우연히 이루어지는 수가 있다. 특히 여성의 협력으로 희망이 성취되는 수가 있다. 그러나 큰 사건이나 큰 문제에는 통하지 않는다.","특수한 업종, 예를 들면 수산물 판매, 또는 특수기술을 지닌자는 좋은 자리를 얻는다.","미용학교나 호텔학교 같은 곳이 알맞다.","흐리고 바람이 불지만 비가 내릴 정도는 아니다.","천풍구(天風구)","44"
"[췌]의 원뜻은 풀이 밀접해 있는 것으로 사람이나 물건이 집중해 있다는 의미로 사용한다. 땅위에 연못의 물이 모여서 초목이 무성하고 사람이 모여들어 교역이 시작된다. 마치 사막의 오아시스와 같다. 여행하는 자는 오아시스를 만나서 하늘의 은총에 감사한다. 이 괘는 현재의 번영이 하늘이나 조상의 덕으로 되었기 때문에 그것을 감사하는 마음을 잊거나 자기의 힘을 과시해서는 안 된다는 점을 경계하고 있는 것이다. 또한 연못의 물이 땅위에 모이는 형상이기 때문에 홍수가 나도 풍작을 이룬다거나 또는 호수 , 온천을 나타낸다고 생각할 수도 있다. 옛부터[잉어가 용문으로 오르는 상]이라고 말해져서 임시, 취직, 인사이동 같은 일에 대길한 괘다.

[췌]라는 것은 취(聚), 즉 모인다는 뜻이다.
유순하고 기뻐하여 강건중정한 군주와 유순중정한 신하가 서로 호응하고 있다. 그런 까닭으로 많은 사람과 물자가 모여든다. 왕자는 종묘에 나아가 조상의 신령에게 참배하고 번영을 진심으로 감사하면서 성대한 제사를 지낸다. 뛰어난 지도자를 따르며 정도를 지니고 [취]의 도를 행한다면 더 한층 뻗어발전하리라. 이 겸허한 태도를 굳게 지키면 길하다. 지금 바로 국력이 융성한 때를 맞이하여 큰 희생을 받쳐 성대한 제사를 지내고 과감하게 전진해 나아가는 것이 좋다. 그것이 천명을 순응하는 것이다. 길함이 틀림없다. 어디서 어떻게 모이는 가를 자세히 관찰하면, 천지만물의 실정을 알 수 있다.","연못의 물이 땅위에 있다.
이것이 [췌]의 괘상이다. 사람이 모이면 뜻밖의 변괴가 생긴다. 군자는 이 괘상을 보고 군비를 튼튼히 하고 불의의 사변을 경계하는 것이다.","[췌]의 뜻은 모인다는 것이다
풀이 무성한 곳으로 사람이나 물건이 모이는 것을 말하고 있다.
제왕이 종묘에 참배하고 성대한 제사를 지내고 또한 많은 제물을 받쳐 마음으로 조상에게 감사하고 자기의 행동에 의해 백성의 마음을 모으는 일이 제정일치의 효과를 올리게 되는 것이다. 이것이 정치의 요점이라고 하는 것이다.","옛 사람의 말에 [잉어가 용문에 오르는 상]이라고 했는데 이는 소위 등용문을 말하고 있어서 수재들이 모여든다는 것이다. 운세는 강할 때이다.
[췌]는 모인다는 뜻이기 때문에 무슨 일에도 물건이 모이고 이익이 찾아오는 것이다. 따라서 사람들도 즐거이 모여든다. 이럴 때는 지위의 승진이 많을 때여서 풍족하게 뻗어 나갈 때이다.
그러나 사람이 모일 때는 좋은 일이 있는 반면 경쟁도 심하고 분쟁도 일어나기 쉽다는 것을 명심해야 한다. 그러므로 싸우지 말고 이를 얻을 수 있도록 사람들과의 화목과 정치력이 필요할 것이다.","재운이 풍족할 때다. 그러나 한곳에 동결되어 있어서 잘 풀리지 않을 때이다.","원활하게 진행될 때이다. 단지 [두 마리 토끼를 쫓다가는 한마리도 못 잡는 격]으로 분명한 태도를 취하지 못할 때 중요한 것을 잃게 된다.","아주 길하다. 좋은 인연이 맺어질 때다. 많은 축하객의 선물도 받을 것이다.","호홉기의 질환이 많을 때이다. 감기에 주의하도록.","운세가 강할 때이기 때문에 성공할 것이다. 그런데 목표가 두가지 있어서 어느 쪽을 선택할 것인가 망서리지만 그때 그때의 당면한 사정에 따라 적당히 처리해 가는 것이 좋다. 너무 외고집으로 나가지 말 것.","너무 물질적인 이익만을 생각지말고 성의를 가지고 교섭에 응해야 한다. 대량생산의 상품은 값을 좀 내리는 것이 좋다.","밖에서 잃은 물건은 사람이 찾아준다. 가령 증명서 같은 것은 곧 되돌아 온다. 집안에서 잃은 물건은 부엌이나 마루를 찾아보라.","여행에는 좋을 때이다. 단체 여행이 많을 때다. 집이 좀 비싸지만 좋은 주택이 나선다.
꼭 이사를 할 사정이라면 비싸더라도 사는 편이 좋다.","경쟁자가 많기 때문에 강한 신념을 가지고 버티고 나가야 한다.","큰 회사에 취직하는 것이라면 좋은 결과를 얻는다. 그러나 제 2의 목표에도 시험을 보도록 하라.","공립이나 국립계통의 학교를 지원하라. 역시 제 2지망교에도 시험을 보도록 대비할 것.","흐린 날씨가 계속되다가 비가 내릴 것이다. 그러나 일단 내리면 긴 장마가 질 것이다.","택지췌(澤地萃)","45"
"[승]이란 솟아오른다는 것이다. 땅 밑에 싹이 돋아 어린 나무가 하늘을 향해 쭉쭉뻗어가는 모습을 나타내는 괘다. 위로 뻗음을 나타내는 괘는 세가지가 있다. [진],[승],[점]인데 그 중에도 순조로운 성장이라는 점에서는 이 괘가 최고다. 세력으로 본다면 욱일승천하는 진이 가장 왕성하지만 아무래도 위험과 왜곡됨이 따르기 마련이다. 이 괘는 견실하게 또한 자신을 가지고 양상하는 것을 나타내고 있다. 어린 싹에는 봄이란 계절과 강렬한 생명력과 풍부한 영양분을 필요로 하는 것이다. 

[승]은 크게 뻗어 발전한다. 유효(부드러운 새싹)가 때를 얻어 솟아 오르고 겸양과 유순의 덕을 구비해서 강효와 바로 응하고 있다. 그런 까닭으로 크게 뻗어 발전하는 것이다. 뛰어난 지도자를 따라 가도록 하라. 아무 근심도 없을 것이고 즐거움이 찾아올 것이다. 남쪽으로 가면 뜻을 성취해서 길 하리라.","땅속에 나무가 생긴다. 이것이 [승]의 괘상이다. 군자는 이 괘상을 보고 나무의 성장을 쫓아 작은 것을 쌓고 또 쌓아 점차로 높고 커지는 상태에 이르는 것이다.","[승]은 오른다는 뜻이다. 새로운 희망을 향해 노력하면 반드시 도달한다. 또 자기의 재능, 실력을 올바로 평가하고 그것을 인정해 주는 연장자의 의견을 따름으로서만 자기의 힘을 충분히 발휘할 수 있다. 염려하지말고 목표를 향해 매진하도록 하라.","[승]은 지하에 묻힌 종자가 싹이 터서 따스한 햇빛을 맏아 무럭무럭 성장해서 후에는 큰 나무가 되어가는 과정을 말한다.
모든 운세가 솟아 오르는 기운을 타고 있다. 지위의 승진, 승급의 기회가 찾아온다. 또한 [승]은 단번에 비약하는 것이 아니고 단계를 밟아 차근차근 솟아오르는 것을 말한다. 또한 실력이 있어도 눈에 띄지 않는 입장에 놓인 사람은 등용되는 기회가 온다. 또한 자기편에서 적극적으로 윗사람이나 선배를 찾아 도움을 바랄 수 있는 좋은 기회다. 목적을 세우고 3개월간 길어도 3년안에는 결실을 맺을 수 있다.","일한만치의 수입과 이윤을 얻는다.
처음부터 큰 이익을 바라서는 않된다.","새로운 연애관계가 생긴다. 나이 어린 소녀와의 정사(情事)가 생길 때다. 또한 오래 지속된 연애에서는 임신하는 일이 생긴다.","좋은 중매자가 나타나서 혼사가 빨리 이루어진다. 점괘가 좋다.","병근이 깊고 뿌리박혀서 표면에 나타나지 않을 때다. 원인이 두가지 있는 경우가 많다. 보통은 소화기병으로 인한 쇠약 상태, 신장과 췌장의 악화로 인한 것이다. 더 악화되기 전에 종합진찰이라도 받아서 병근을 찾아 치료해야 한다.","새로운 계획과 아이디어를 발표하거나 새로운 사업에 착수할 때이다. 또한 새로운 계약을 맺는 일이 많기 때문에 신용을 지키는 일이 중요하다. 사업을 성장시키는 좋은 운세에 놓여있다.","목적한 대로 밀고 나가라. 반드시 좋은 결과를 얻을 것이다. 한번 실패했다고 해서 중단함은 금물이다. 두번 세번 되풀이 해가면 반드시 목적은 달성된다. 한참 뻗어가는 운세를 갖고 있기 때문이다.","대개는 낮은 곳에서 찾을 수 있다. 주위 사람들의 도움으로 빨리 찾아낼 수 있을 것이다.","여행은 기분 좋게 할 수 있느나 일정이 늦어져서 계획의 차질을 가져온다. 좋은 집을 찾기 위해서 잘 아는 사람에게 부탁하는 것이 좋다.","밝은 희망을 가지고 자기가 원하는 바를 수행해 갈 것. 특히 남쪽 방향이 좋다.","희망이 있다. 꾸준히 기다린 보람으로 마침내 기회가 찾아온 것이다. 곧 통지가 있으리라.","좋은 결과를 얻을 것이다. 정신적인 학문을 전공하는 것이 좋다. 또한 여성은 양재나 미용계의 학교가 좋다.","구름이 낀 날씨라도 바람이 있다. 하천에는 밀물이 닥쳐서 물이 많아진다. 밤 중에 비가 올 것이다.","지풍승(地風升)","46"
