basic,daesang,basic1,unse,cash,love,marriage,health,business,trade,miss,travel,wish,employ,school,weather,name,idx
"[隨]라는 것은 따른다는 것.
[따른다]는 것은 주체성을 잃고 물결의 흐름에 몸을 맡겨버리는 것이 아니다. 무엇을 따를까, 이것은 주체성의 결단에 달려 있는 것이다. 따라갈 대상을 확실히 정해야 한다. 상괘는 젊은 여자, 하괘는 중년의 남자다. 중년남자가 소녀에게 반해서 따르는 형상이다. 또한 실력있는 자가 한 걸음 물러서서 자기 아래의 사람에게 따르는 형상이다라고도 볼수 있다. 어떤 경우든간에 진지하게 행동을 한다면 반드시 좋은 결과가 올 것이다. 이 괘는 사계절에 적용한다면 가을이 된다(일설에는 이른 봄이라고도 한다). 왕성하던 기운이 쇠할 때 사람을 따르는 기분을 잊지 않도록 해야 한다.

수의 괘는 강(강함)이 유(부드러움)에 따르는 형상이다. 강이 움직여서 따르고 유도 기꺼이 받아드린다. 이 도는 크게 뻗어서 발전한다. 변함 없이 지조를 지켜나가면 만사가 순조로워 허물이 없다. [수]의 도를 실천하게 되면 천하의 백성이 기꺼이 따른다. 수의 뜻은 참으로 큰 것이다.","천둥의 계절이 지났고 그 에너지가 연못속에 잠복한다. 이것이 [수]의 괘상이다. 군자는 이 괘상을 보고 날이 저물면 들어 앉아 휴식을 취한다.","수는 따른다는 뜻이다.
옳은 것을 인식하고 그때 그때에 적절하게 따라가는 편이 오히려 일을 원만하게 해 나갈 수 있게 된다.","수에는 가을에 소리를 내는 우뢰라 하는 의미가 있다. 우뢰는 여름에 그 힘이 대단한 것이지만, 가을에 들어서면 그 소리도 약해지며, 자연히 지하로 숨어 들어가 없어져버리는 상태를 뜻하는 것이 이 수다. 그러므로 자기에게 실력이 있어도, 시기적으로나 환경상으로도 사람을 따라 그 일을 처리해 가지 않으면 안 되는 사정에 놓여 있다.
그리고 그때 그때의 변화에 따라서 좋은 결과가 얻어진다. 이 괘가 나올 때는 마치 물이 없으면 물방아는 돌아가지 않고 물방아가 돌아가지 않으면 쌀을 찧을 수 없다고 하는 입장과 같다. 수력발전에도 사용되고, 물은 그때 그때에 따라서 그 능력을 발휘하는 것이다. 또 이 괘가 나올 때에는 자기의 주변에 변화가 일어나기 시작하고 있을 때다. 모두 새로운 사태에 따라 행동해야 한다. 예컨데 근무처가 바꾸어졌다든가 이사했다던가, 또 자기의 목적이 변화했다던가, 그런 경우와 같은 것이다.
고요하고 좋은 운이지만, 적극적인 운수는 못되고, 소극적으로, 내부관계를 서서히 고쳐가는 방침이 좋은 때다. 지금까지 맹렬하게 활동하고 있었던 사람은 일시 휴양을 취하든지, 또는 고향에 잠시 가 있는 것도 좋은 일일 것이다.
또 가령 당신이 실력이나 경험을 풍부하게 가지고 있어도 때에 따라서는 자기보다 실력이 없는 사람 아래서 일하지 않으면 안 되는 일도 있다. 당신은 큰 마음으로 상대를 돕는다는 생각으로 새로운 사태속에 무리하지 않고 끼여 들어가는 편이 당신도 행복한 상태에 놓인다. 공연히 반역적인 기분을 가졌다면 좌절이 생긴다.","비교적 돈에는 운이 있고 수입도 많아져가는 때다.","나이의 차가 있는 연애가 많은 때다. 나이 먹은 남성이 젊은 여성에 정신이 팔린다던지, 여성이 나이가 젊은 남성을 사랑하게끔 되는 때다. 또 삼각관계와 같은 이성문제도 생긴다.","나쁜 괘는 아니다. 또 재혼에도 좋을 것이다. 단 결혼후에 서로가 정신적인 융화에 마음을 쓰고 다른 정사관계로 상호간에 다툼이 생기지 않도록 주의하지 않으면 안 된다.","호홉기의 쇠약, 구토, 변비, 정력감퇴, 월경불순 등이다. 노인은 계절이 바뀔무렵 조심해야 한다.","그 때의 유행이나, 모드나 시운에 맞추어 적절히 임기웅변의 조처를 취한다면 결과가 좋은 때다. 주위에 대한 관찰을 소흘하게 하지 않고 또 자기가 앞장서서 나아가도 안 된다.","상대는 핑계를 만들어 이렇다 저렇다고 구실을 부쳐 당장에는 승낙하지 않지만 끝까지 인내성 있게 달라 붙으면 일은 해결된다. 상대는 꽤 말을 잘 하고 장사에 능한 사람이다.","즉시 발견하기 어렵다. 거의 잊어먹을 무렵에 뜻밖에 발견될 수도 있다. 집안에선 남쪽과 서북쪽을 찾아보도록.","회사의 위로여행이 있고, 여행처에서 연회가 벌어지는 경우가 있는 때다. 또한 사랑하는 남녀가 사랑의 도피여행을 하는 때다. 이사는 좀 조용한 곳이 발견될 것으로 생각한다. 전업 등에도 좋은 때이다. 지금까지의 화려한 일에서부터 남의 눈에 그다지 안 띄는 건실한 일로 바꾸는 것이 좋을 것이다.","새로운 방향, 희망, 목적으로 나가는 것이 좋다. 어려운 문제가 생길지라도 실력자를 앞장세우고 자기는 위에 숨어서 일을 하면 그런 문제는 해결이 나는 때다.","자기를 도와주는 사람도 있고 해서 취직은 된다. 그러나 되었다고 할 때 힘을 써준 분에게 깊은 감사의 사례를 하는 것을 잊어선 안 된다.
또 여성이긴 하지만, 그런 일에는 힘을 쓰는 것을 좋아하는 사람을 만나게 되는때다.","입학은 된다. 당신의 실력보다도 좀 낮은 학교에 입학이 된다. 씁쓸하게 생각치 않도록.
분수를 지켜야 할 괘이니까.","때아닌 우뢰가 있을 때다. 또 처음은 개인, 좋은 날씨지만 머지않아 비가 오지 않으면 흐린날씨로 변할 것이다.","택뢰수(澤雷隨)","17"
"[고]란 기물을 벌레들이 파 먹는다. 또는 접시에 가득담은 음식에 벌레들이 우글거려고 있다는 말이다. 태평이 계속되면 내부에 부패와 혼란이 진행한다. 괘의 형상도 산기슭에 바람이 불어닥쳐 재해를 일으키는 형상이다. 또는 중년부인이 젊은 남자를 유혹하는 형상을 나타낸다.
천지이변, 풍기문란 참으로 다사다난하다. 그러나 절망할 일은 없다. 궁하면 통하고 모순이 깊으면 깊을 수록 반대로 근본적 해결이 가능하다. 이것을 기회로 삼아 내부를 파 먹는 병균을 철저하게 헤쳐내야 할 일이다. 부패와 혼란의 시기는 동시에 혁신, 신생의 시대인 것이다.

[고]의 괘는 강(강함)이 위로 향하고 유(부드러움)가 아래를 향해서 서로 교합되는 일이 없다. 부하는 호로지 맹종할 뿐이고 상사는 하는 일이 없이 날을 보낸다. 이것이 [고] 즉 부패혼란의 상인 것이다. 그러나 후에는 크게 뻗어서 발전하고 천하는 다시 평정하게 다스려 질 것이다. 적극적인 진취의 정신으로 일을 대하고 큰 강을 건너는 위험이라도 극복해 가는 것이 좋다. 사물의 이치는 항상 변화하며 궁극에 으르면 새로운 것이 시작된다. 이것이 하늘의 도다. 지금이야말로 개혁의 때. 새로운 시대의 창조에 있어서는 지금까지의 경과와 앞으로의 전개를 신중히 고려해서 행동해야 한다.","산기슭으로 바람이 거칠게 불어닥친다. 이것이 곤의 괘상이다. 군자는 이 괘상을 보고 괴로워하는 백성을 구하고 몸의 덕을 기른다.","고는 깨짐의 뜻이다.
파괴된 것을 원상으로 재건하는 데에는 상당한 노력과 신중한 계획 및 실천력이 있어야 한다. 갑자(甲子)는 10간의 첫째다. 행동을 개시하는데에는 삼일 전에 계획을 짜고 삼일 후에 행동한다고 하는 의미다. 그렇게 하면 실패는 없을 것이다.","고는 과거의 평화로운 상태아래 살았던 사람이 그 안이한 생활에 너무나 습성이 되어 안이성을 타파하지 못해 자기도 모르는 사이에 생활이 물질적으로 파탄하는 지경이 되고 또 정신적으로는 퇴폐적인 생활을 보내게끔 된 상태를 표현하고 있는 괘다. 과거에 저지른 일의 결과가 나타났던 것이다. 때문에 운수타개를 위해 여기에서 뭔가 그 방법을 생각하지 않으면 안되는 때가 왔다고 본다.
이렇게 말하는 것은 과거에 지낸 습관화된 좋지 못한 생활을 쇄신하지 않으면 안 되기 때문이다. 그 때문에 어찌할 수 없이 부패하여 냄새가 나는 상태를 절개수술을 해버리는 당신의 기력과 결단성이 필요한 때다.
친척, 내부관계에서 자주 분쟁이 발생하기 쉬운 때이기 때문에 냉정한 비판력을 가지고 서서히 정리 단계에 들어가야 할 것이다. 단숨에 정리한다는 것은 무리하다. 부작용이 생기기 때문에.
또 자기자신도 고독한 점에서 이찌할 수 없는 정신적인 괴로움이 있을 때다. 하고싶은 말을 당장 말하지 못 하는 입장에 있다든지, 또 상대가 일방적으로 자기 의견을 강요하기 때문에 나 자신은 무거운 심리상태에 빠져드는 것이다.
인간의 성질은 표면상 신사적으로 확고부동하게 보이지만, 내심은 불안정하고 또 걱정거리를 가졌다든지 아니면 화려한 것을 좋아하는 습성이 보편적이라 할 수가 있으며 그래서 화려한 것을 좋아하는 사람이 많은 법이다.","일상생활의 경우라면 별 지장이 없을만큼의 돈은 있다. 그러나 투자가는 큰 일에는 손을 안대는 것이 좋을 때다.","상당히 진행되어 있는 상태라해도 좋을 것이다. 그 중에는 부자연한 상태에빠져 있어서도, 좀체 떨어지지 못하는 사이도 있다. 보통의 경우는 오래 가지 못하는 것이 많은 때이며, 정사관계가 복잡한 것이 많다. 연애가 묘하게 비밀에 쌓여있다.","정식 결혼이라면 서로 조화가 잡이지 않기 때문에 중지하는 것이 좋을 것이다. 좌우지간 초혼이거나 재혼이거나 똑같으며 재혼의 경우가 많을 때다.","유전체질 또는 선천성 매독, 섹스에 기인하는 것이 많다. 개중에는 상당히 병세가 진행되어 있는 것도 있다. 이 병은 이미 많이 진행되어 뼈나 피부에 상처를 줄만큼 악화되어 있다. 간단한 병으로는 감기를 자주 앓게 된다.","낡은 사업관계가 시대의 흐름에 따라 새로이 그 면목을 일신하지 않으면 안 될 상태로 되어 있다. 부친이 하고 있었던 사업이 시대의 흐름에 맞지 않아 실패한 뒤를, 자식이 맡아서 성공시키는 때다. 가정에선 어머니가 딸에게 [바톤]을 넘기어 가사의 책임을 맡게끔 하는 편이 좋을 때다. 밖에서나 안에서나 세대교체는 자연이 오는 것이다.","상대로부터 자주 교섭이 오는 때다. 무리가 생기는 거래는 일단 취소하여 새로 시작하는 편이 좋을 것이다. 왜냐하면 우리쪽이 유리하니, 유리하게 거래하기 위하여 그렇게 할 수 밖에 없다.
정리와 청산을 해야 할 때이기 때문에 닥쳐오는 사태에 대하여 만반의 체계를 갖춰두는 것이 상책이다.","대체로 집안에서 잃어버린 때가 많다. 물건 밑에 일부러 숨겨 둔다든지, 다락이나 기타 엉뚱한 곳에 숨겨져 있는 수가 많다. 사람이 장난삼아 숨긴다든지 또는 질투심이 많은 사람이 고의적으로 했을 경우도 있다.","여행가지 못하는 때이기는 하나 기분전환을 위한 소여행이라면 무방하다. 이사는 기분을 바꾸기 위해서도 좋을 것이다. 또 전업도 빨리 실행하도록. 집을 살 때는 잘 조사한 후가 아니고선 실수하기 쉬우며, 파손한 곳이 상당이 있을 것으로 보인다.","지금까지의 일에 성과를 못보고 일단 결말을 지었으면 기분을 새롭게 하여 새로운 방향으로 바꾸는 편이 좋을 것이다.","지금 당장은 불가능하다. 내부의 분쟁을 속히 정리하는 것이 급선무다. 
이런 때에는 지금 일하고 있는 곳을 그만둘까, 어떨까하고 생각하는 일이 많다. 내부에 부정이 있을 때는 일단 집어치우고 자기 과거에 경험이 있는 일, 또는 남이 하다가 치운 뒤를 인수해서 하는 일이라면 좋을 것이다.","아버지 또는 어머니가 나온 학교라면 유리하다. 그러기 위해서는 다소 외교성도 발휘할 필요가 있다.","바람은 있어도 흐린 하늘이다. 다소 우울한 날이다. 그러나 태풍 때는 상당히 피해가 있을 것이다. 논, 밭에는 해충의 염려가 있다.","산풍고(山風蠱)","18"
"임이라 함은 위로부터 아래 것을 내려다보는 것, 즉 위로부터 지배와 보호를 아래에 미치게 하는 것이다. 지배의 방법은 여러가지지만 이 괘는 상하가 가까이 지내는 상태를 나타낸다. 또 아래에 두가지 양이 있어 운기가 점점 융성해 질 때다. 그러나 이런 경우는 단기작전, 급속히 성하고 곧 쇠할 경향이 있어서 시기를 보는 바가 민감해야 한다. 또 열중하는가 생각하면 곧 잃어버리고 마는 인간의 유형을 나타내고 있기 때문에, 어지간히 정신차려 대하지 않으면 일생 후회를 남기기가 쉬운 것이다.

[임]의 괘는 강건한 양의 기운이 점점 왕성해지고 상하가 가까히 지내며 기뻐하고 순종하는 형상이다. 천도(天道)에 맞음으로서 크게 뻗어서 발전한다. 변함없이 지조를 지켜 나가면 만사가 순조롭다. 그러나 사물이 성하면 반드시 쇠하는 법. 팔월 양기가 쇠퇴할 떄가 오면 흉조로 변하게 된다.","기슭에 서서 연못에 임하다. 이것이 [임]의 괘상이다. 군자는 이 괘상을 보고 어디까지나 백성을 인도하며 한 없이 포용하는 것을 원할 것이다.","임은 임함, 군림하는 것이다.
봄에서부터 여름을 향하여 양기가 왕성하여지는 것처럼 일이 서서히 왕성해져 간다고 하는 것이다. 여름도 지나가서 가을을 거쳐 겨울로 계절이 바뀌어지면 지상으로부터 양의 기가 사라져 음의 기가 커져가는 것이다. 이와같이 8월이 된다면 기후의 전환기를 빨리 통찰하여, 가을, 겨울의 준비를 서둘러야 한다. 사람도 운세가 절정일 때에 일찌기 주의하는 것이 좋다고 하는 것이다.","임은 만물이 새로히 시작한다고 하는 의미가 있기 때문에 대체로 운기는 이제부터 상승해 가고 있을 때다. 그러나 힘이 강한 괘이기 때문에, 모든 일에 너무 앞질러 나가는 경향을 가지고 있다. 새로운 계획를 착수함에는 좋은 기회이지만, 충분히 장래의 전망을 세우지 않고선 행동해서 안된다. 봄의 좋은 날씨에 가을이나 겨울의 험한 날씨를 미리 생각하는 것은 좀 무리한 요구이지만 그러나 그런 일을 생각하지 않을 수 없는 것과 같이 일생에 있어서도 미래를 바라보고 전망을 세우지 않고선, 행동해서 안 된다. 봄의 좋은 날씨에 가을이나 겨울의 험한 날씨를 미리 생각하는 것은 좀 무리한 요구이지만, 그러나 그런 일을 생각하지 않을 수 없는 것과 같이 인생에 있어서도 미래를 바라보고 전망을 세우지 않고선 행동하기가 어렵지 않겠는가. 그런고로 이 괘가 나올 때는 특히 무드의 변화에 보조를 맞추는 것이 중요하다고 본다.
운이 봄에서 여름으로 행하는 좋은 괘다. 지위의 승진, 또 봉급도 오르는 때다. 동시에 영전도 있을 것이다. 학생이라면 외국유학의 기회가  생기는 때이지만, 장래의 계획을 세워서 나가는 것을 권하고 싶다.","경제상태는 비교적 여유가 있어서 부자유스러운 일이 없을 것이다. 모든 면에서 자기 힘에 겨운 짓은 하지 말고 여유있게 적절히 하여야 한다. 생활이 화려해져서 교제 범위가 넓어지기 때문에 실비가 많아지는 때다.","남녀 서로가 활달하고 화려해서 감정이나는 대로 행동하는 때다. 드라이브나 오페라 등 화려한 곳을 좋아하는 남녀 두사람이다. 소위 달콤한 생활을 보내는 떄다. 그러나 결혼으로 가기에는 상대가 가정사정 때문에 주저하는 마음으로 있을 때다.","정식 결혼이라고 한다면 이 쪽은 대단히 열을 올리고 있으나, 상대는 그다지 마음이 움직이는 편이 아니다. 그렇지만 일이 성사만 되면 그다지 나쁜 연분은 아니기 때문에 마음을 정하여 열심이 성사되게끔 노력하는 편이 좋을 시기다.","보통으론 건강한 괘다. 사소한 병을 가진 사람이라면 곧 회복되어 갈 때다.
정신이 불안정하기 때문에 실제의 병보다 무겁게 생각하고 있는 수가 있다. 기력을 되찾으면서 체력도 회복하여 가는 때다. 그 밖에 호홉기계통, 각기, 소화기계의 쇠약, 여성은 히스테리, 남성은 성급하게 되기 쉬운 때이다.","화려한 때다. 새로운 사업에 착수할 때다. 신입사원의 모집도 많이 있는 때다.
그러나 모든 사업에 있어서와 같이 이 경우에도 감독 및 리더에 신중한 인물이 필요하다. 또 남에게서 부탁 받은 일에는, 충분히 그힘을 발휘할 수 있는 입장에 놓여 있을 때다.
장기적인 일에는 이 괘가 맞지 않는다.","강경책보다는 온화책이 효과를 내며, 위험도 없다. 왜냐하면 상대는 이쪽에 대하여 대단히 압박감을 느끼고 있기 때문에 달콤한 이야기 일수록 주의가 필요하다.","외출하였을 때 잃어버린 물건이 많고, 특히 사람이 많이 출입하는 곳에서 잃어버린 물건이 많다. 집에서 잃어버린 때는 서쪽 및 서북쪽을 찾아보도록.","단체여행, 수학여행, 즐거운 여행등이 있을 때다.
숙명적으로(어쩔수없이) 이사하게 되지만, 이사한 곳에 오래 있지 못하고, 또 다음 곳에 이사해야 할 상태가 되기 쉽다.","소원을 성취한다. 장래의 장기적인 소원보다도, 신변 가까운 일이 특히 빨리 실현되는 때다. 아무리 바쁜 때일지라도 마음에 여유를 갖지 않는다면, 그만큼 행복은 적어진다. 만사에 마음의 여유가 필요하다.","지금은 좋은 기회다. 서둘지 말고 좋은 일터를 잡아야 한다. 상대방에서 기쁘게 맞아들이는 경우가 많을 때다.","운수도 강하고 모든 점에서 좋은 조건에 있기 때문에 시험장에서 당황하지 않는 것이 중요한 일이다. 즉 마음을 안정시킨다면 합격된다. 조심해서 해답을 답안지에 써 넣어야 한다.","여름이라면 상당히 큰 소리를 내는 우뢰가 치지만, 이 괘는 지방에 따라서 일정하게 결정짓지 못하는 점이 있다. 대체로 비가 내리는 걱정은 없을 것이다.","지택임(地澤臨)","19"
"[관]은 응시하는 것.
그저 막연히 보는 것이 아니고 자세히 관찰하는 것, 깊은 곳까지 꿰뚫어 보는 것이다. 이 괘의 형상은 음(陰)의 세력이 위의 양(陽)을 밀어버릴듯한 세력을 보이고 있다. 또 땅위에 바람이 거칠게 불어오는 상태를 나타내고 있다. 군자의 도가 쇠하고 사리사욕이 서로 싸워서 질서가 붕괴되는 시기다. 그러나 이러한 때일수록 심사숙고해서 현상의 깊은 곳까지 투철하게 봐야한다. 이러한 태도가 진실로 몸에 붙는다면 덕이 되어 사람들을 감화시킬 수가 있다. 행동보다도 심사숙고하는 단계이기 때문에 지도적인 지위에 있는 사람, 즉 교육자, 학자, 연구자에게는 좋은 괘다.

[관]은 관찰하는 것. 천자가 위에 있어 유화하고 겸허,중정의 덕을 가지고 천하를 보는 것이다. 손을 깨끗이 하고 신 앞에 나아가 번잡한 의식과 예의를 차리기 직전, 제사를 지내는 자가 순수하고 정성된 마음에 넘쳐 있어서 엄숙한 분위기가 주위를 지배하고 보는 사람들의 마음을 감화시키는 상태다. 신령하고 오묘한 하늘의 도를 보라. 사계절의 운행은 조금도 순서가 어긋남이 없이 계속된다. 성인은 이 신령하고 오묘한 도에 따라 가르침을 줌으로서 천하를 심복케 한다.","바람이 땅위를 불어 가느 것. 이것이 관의 괘상이다. 성왕은 이 괘상을 보고 온 천하를 순찰하여 백성의 풍속을 본 후 가르침을 준다.","관은 정관 관찰이라는 의미가 있다.
위로부터 아래로 내려다 본다고 하는 것이다.또 아래쪽에선 웃사람을 존경하는 마음으로 위로 쳐다보는 것을 말한다.","관은 정신적인 문제를 취급하는 일에는 좋은 점(占)이다. 특히 종교, 학문, 연구등에는 진보발전이 있으며 대단히 좋다고 본다. 그러나 관념적이라는 말은 좀 굳은 의미가 있기 때문에 될 수 있는 한 융통성을 가지고 남의 좋은 의견을 받아들이도록 해야 한다. 그러나 정신면에 좋은 괘의 경우는 물질면에서 욕심을 내지 못하고 이익의 면에서도 충분하지는 않다. 고로 이러한 때에는 확장보다도 내부를 충실하게 하는데 노력하는 편이 좋은 때다. 또 관에는 큰 산이라 하는 의미가 있기때문에 남으로부터 부럽게 여김을 받는 입장에 서있는 사람은 그것을 오래 유지하도록 마음을 쓰지 않으면 근간 변화의 전조가 보이기 시작하는 때다. 언제나 좋은 자리는 오래 가지 않으니 조심하도록. 권불십년(권세는 10년 가기 어렵다)이란 말은 이런데서 오는 듯 하다.","욕망으로부터 자기를 멀리하여 조용한 일상생활을 할 때다. 그러나 적당한 수입은 있다.","당사자끼리는 정신면에서나 육체면에서도 지극히 사이가 좋을 것이다. 오직 현재의 연애를 결혼에까지 이끌어 간다고 할 때, 양쪽 가정의 간섭이 있다든지, 일과 가정이 양립하지 못하는 것과 같은 점이 보이는 듯 하다.
이 괘는 남성이 약한 입장이기 때문에 여성은 무슨 직이라도 가진 편이 가정생활을 원만하게 이끌어 갈 수 있다.","당사자끼리는 잘 되어 가지만 주위의 사정 때문에 결말을 보기에는 힘이 상당히 들 것이다.
결혼 뒤 가족들로부터 간섭이 너무 많을것이다. 또 남성은 건강에 특히 유의하지 않으면 안 된다.","정력감퇴, 혈행불순, 어깨가 쑤시는 등 아프다. 호홉을 못하는 아픔이 있다. 식용부진, 설사, 중환자에겐 위험기로 들어가는 때다.","빠르다는 느낌은 있으나, 모두 다 제동을 걸어야 할 때다. 새 계획이나 새 사업의 착수는 절대로 금해야 한다. 상대가 이야기를 가지고 와도 명확한 내용의 것은 아니다. 또 당신 자신에게도 확고한 생각이 서 있지 않아 망설이는 점이 많고 여러가지로 귀찮은 일이 꼬리를 물고 일어나는 때다. 그러니 천천이 살피는 사람이 아니면, 극히 동요하며 마음의 갈피를 잡지 못 할 일이 많은 때다.","앞으로 나갈 때가 아니다. 또 이 쪽이 적극적으로 나가지 못하는 사정이 있을 때다. 재판을 한다면 이기지 못한다. 특히 남성자신에는 신변에 여러가지로 주의하지 않으면 안 되는 일이 일어나기 쉬운 때다. 
자기의 상황을 남으로부터 늘 감시받고 있는 때다. 또 가정에선 도난이 생기니 주의하지 않으면 안 된다. 
학문이나 종교등에 종사하고 있는 사람은 남한테 존경을 받기 때문에 특별히 몸을 삼가해서 행동하지 않으면 안 된다.","집안에서 잃은 물건이라든지, 큰 물건이라면 찾아낸다. 작은 것이라면 이미 밖에서 누군가가 가져가 버렸다.","돈이 들지 않는 여행, 또는 등산. 캠프나 정신적인 견학여행등에는 좋은 때다.
절대로 이사하지 않는 편이 좋다. 그러나 사람에 따라선 숙명적으로 이사의 움직임이 있는 사람도 있다.","고상한 취미, 연구, 정신적인 것이라면 성취 하기 쉬울 때다.
기다린 사람이 오기는 했으나, 가지고 온 이야기가 보잘 것 없는 것이 많을 때다.
가출인이 많을 때다. 경찰에 신고하는 편이 좋다.","보통의 경우에는 지금까지 해온 일을 잘 보존하는 편이 좋은 때다. 새로운 자리를 구하지 말라.
학교의 선생이나, 종교가등에는 좋은 괘다.","대학에 입학 할 수 있을 때다. 될 수 있는 한 일류학교를 목표삼아 응시하도록. 그러나 안전을 위해 2개이상은 시험을 쳐 봐야 한다.","대체적으로 날씨는 좋고 하늘은 개어있다. 바람이 좀 불고 있으며 곳에 따라선 비가 조금 내리는 정도의 날씨일 것이다.","풍지관(風地觀)","20"
