basic,daesang,basic1,unse,cash,love,marriage,health,business,trade,miss,travel,wish,employ,school,weather,name,idx
"네개의 큰 난괘(좋지않은 괘) 중의 하나다.
[감]은 험난에 빠지는 것을 의미한다. 이러한 때 어떻게 처신하는가에 따라, 인간의 진가가 결정된다. 곤란에 쓰러지고 마는가 아니면 그 괴로움을 견디고 이겨냄으로서 용기와 힘을 기르는가이다. 지금 당장 곤란을 해결하기는 힘들다. 무엇이든 두려워하지 않는 신념과 지성을 가지고 격류와 맞서는 도리 밖에 없다. 몸을 던져야만 나아갈 기회도 생긴다는 격이다.

습감은 험난이 겹쳐 있는 상태다. 그리나 강물은 흘러가서 넘치는 일이 없고 헌남한 곳을 만나더라도 낮은 곳으로 흐르는 습성은 변치 않는다.  사람도 위험을 만나서 성의를 변치 않으면 난관을 돌파하고 혈통한다. 주저하지 않고 나아가면 성공해서 세인의 존경을 받는다. 하늘의 험난은 감히 오를 수 없는 높이이다. 땅의 험난한 곳은 산천과 구릉이다. 임금과 제후들은 성벽을 쌓고 못을 파서 나라를 지킨다. 험괘가 나왔을 때는 대처할 방법을 신중히 생각해야 한다.","홍수가 겹쳐오는 것이 [감]의 괘상이다.
군자는 이 괘를 보고 덕을 기르고 백성을 가르치는데에 전념한다.","[감]은 고민, 곤란, 고생 속에 있어서도, 자기의 신념을 변하지 않고 오직 진심과 충실, 성의의 길을 관철하면 반드시 정성이 이루어진다고 하는 말이다. 현재는 남들에게 알려지지 않더라도 당신의 정도는 언젠가는 남이 알아주는 날이 올 것이다.","[감]은 진실일로(眞實一路)라 하는 의미가 있다. 사람이 고통 속에 있을 경우에 자기를 떠 받드는 것은 자기의 마음, 성심성의, 정성일로의 강인성 이외에는 아무것도 없다. 환경이 불우할 때, 또 물질에 부자유할때, 재난을 당하였을 때에는 잘못하면, 인간이 인간다운 마음을 상실하기 쉬운 때다.
이 감위수는 진퇴양난에 빠져 모든 고통이 일시에 밀어 닥친 때라고 생각해 보도록. 그러니 이러한 때에는 꿋꿋한 신념과 용기가 절대 필요하다.
때로는 마음의 평정을 잃어버리기가 쉽고 그래서 만사를 포기하고 싶은 때도 있지만, 추운 겨울 뒤에는 온화한 봄이 오는 것처럼 나쁜 시기는 오래 가지 않는 법이다. 그러니 참아야 한다.
이 괘의 경우. 종교나 학문과 같은 정신면에 마음을 돌린다면, 난관을 극복한다.
나쁜 의미로선 사기, 폭주에 빠지며, 건강을 해치기 쉽고, 애정을 정신을 빼앗겨 일에 집중하지 못하는 상태다.
또 자기 계획이 있어도, 실행하지 못하고 재미가 없는 데다가, 주위로부터 오해를 받기 쉬운 때다.
또 법적인 관계 및 경찰문제가 일어나기 쉬운 때다.","부자유하다. 이 이상의지출을 하지 말아야 한다.","서로가 애정에 빠져버리고 있는 때다. 남성은 특히 물장사 관계의 여성에 너무 깊은 관계를 맺고 있어서, 금전면에서 곤란을 면치 못하고 있는 때이며, 횡령 등의 걱정도 있을 때다. 
여성도 남성 때문에, 곤란한 지경에 빠져 있는 수가 많을 때다.","좋은 괘는 아니다. 정략적인 결혼이 있는 때다. 육체관계를 떠난 노인들의 결혼에는 좋다.","신경쇠약, 신장결석, 정사가 원인이 된병, 식중독 및 설사, 식은 땀, 빈혈, 각혈 등이다. 귀앓이, 자궁병, 및 월경불순, 주독 등이 발생하기 쉬운 때다.","절대로 적극책은 취하지 말아야 할 때다. 또 이러한 때 일수록 계약은 속아 넘어가기 마련이다. 또 남의 보증인이 되는 것도 삼가야 한다. 하여튼 싸움으로 변하기 쉬운 때다.","모두 가망이 없다. 소송이나 재판문제에 휩쓸린다.
그러나 일의 성질에 따라선, 이면공작으로 공격해 가면 상대의 급소를 잡아서 오히려 성공하는 경우도 있다. 그러기 위해서는 이쪽의 실력과 성의를 명확하게 보이는 것이 중요하다.","도난이 많은 때다. 이 경우 범인은 2인조로 올 것이고 혼자로는 오지 않는다. 또 잃은 물건은 쉽사리 발견하기 어렵다. 찾아낼 수 있다면, 상당히 시간이 흐른 뒤라야 가능한 일이다.","여행애선 안 된다. 간다면 재난을 당할 것이다. 집은 이사하더라도, 또 다시 이사하지 않으면 안 되게끔 되어 있다. 한 집에 소유자가 두 사람이 되는 경우도 있다.","자기 혼자만 알고 있고. 행동도 하지 말고 남에게도 말하지 않는 것이 좋다. 남에게 표시하면 소원성취가 안된다.","안된다. 무리를 하면 취직 사기꾼을 만나서 손해를 본다. 또 유령회사가 많을 때다. 취직한다고 속임 수에 넘어가지 않도록!","무리한 짓이다. 가망이 없다.","비가 오는 날씨다. 우기에 이 괘가 나오면 큰비, 장마라고 봐도 된다. 
이 경우 특히 수난 수해를 당한게 된다.","감위수(坎爲水)","29"
"이의 괘는 불, 태양을 상징한다.
또한 밝음이고 지성이다. 불이 탄다는 사실에서 부착된다는 뜻이기도 하다. 이 괘는 상하가 같고 밝은 태양, 불 같은 정열 그리고 명철한 지성을 나타낸다. 자기의 입장에 튼튼하게 뿌리를 박아 최대한의 능력을 발휘할 때이다. 그러나 정열에 몸을 맡겨 경솔한 행동을 하는 경향이 있다. [암소를 기르면 길하다] 암소와 같은 유순함을 아울러 가지는 것이 중요하다.

이는 부착한다는 뜻이다. 해와달이 하늘에 빛나고 백곡과 초목은 땅에 부착한다. 사람은 밝은 지혜를 가지고 정도를 가지고 정도를 밟으면 천하의 백성을 교화, 육성할 수가 있어 발전하고 번영한다. 유효가 중정의 자리에 있는 것은 암소와 같은 유순함을 기르면 길하다는 것을 나타낸다.","밝음이 겹쳐 있는 것이 [이]의 괘상이다. 대인은 이 괘상을 보고 밝은 지혜를 닦아서 널리 천하를 비추는 것이다.","[이]는 물건에 붙는다고 하는 뜻을 가진다.
자기의 활동을 표현해 가는데에는 당신이 소속하고 있는 또는 의존하고 있는 입장을 잘 살피어 자기를 앞세우는 일 없이 마치 사람에게 온순히 따라가는 암소와 같은 기분을 가지고 가야만 모든 것을 원만하게 할 수 있다고 본다.","[이]에는 또 밝은, 태양, 아름답다의 의미가 있다. 불과 같은 격렬성도 있다. 그 때문에 불의 취급이 어려운 것처럼 앞 날의 전망은 밝을지라도 언제나 마음의 안정이 없고 눈이 쏠리고 자기의 본래 일에 대하여 기본적으로 집중이 되지 않는다.
강한 운수지만 취급하기 어려운 괘다. 좋은 의미를 많이 가지고는 있으나, 어떤 의미로는 격렬성이 있는 괘이기 때문에, 이런 때에는, 사물을 면밀히 신중하게 진행시키지 않으면 위험이 생기는 때다. 마치 자동차로 화약을 운반하고 있는 것 같은 위험천만한 경우도 있다.
기분적인 면에선 극단으로부터 극단으로 마음의 변화가 생기기 쉬운 때다. 같은 성질의 사람과의 사이에선 너무 상대의 마음을 잘 알고 있기 때문에 사이가 좋은 데도 무엇인지 솔직하게 나가지 못하는 점도 있는 상 싶다.
이런 때 자기 힘만 믿고 행동하면 십중 팔구는 실패하고 만다. 당신이 아무리 현명할지라도 견식이 있는 사람, 유능한 사람의 의견은 받아들이는 편이 좋은 때다. 옛날 사람은 이 괘를 대단히 좋다고 했다. 당신에게 있어서 좋은 날은 단기적으론 2일, 5일에는 기회가 있고, 장기적으로는 두달, 다섯달로 접어들어 가야 기회가 온다.","보통 부자유스러운 점은 없으나, 주위가 화려해서 교제비등으로 헛된 지출이 많은 때다.","서로가 상당히 열도가 높은 때다. 열띤 사랑이지만, 서로 같은 성질의 소유자이기때문에 결혼할 용기가 없는때다. 서로 장단점을 너무나 잘 알고 있기 때문이다. 또 이런 때에는 사랑의 위험한 장난도 상당히 많은 때다.","안면이 많은 사람들의 결혼시즌이다. 서로가 허세를 너무 부려, 결합이 잘 안 된다는지 또 두 곳에서 나온 이야기 사이에 끼어서, 어느쪽에도 결정을 짖지 못하고 있는 일이 많을 때다. 이 괘가 나올 때에는 서서히 하는 것이 좋은 때다. 또한 재혼에는 대단히 좋은 괘다.","고열의 것이 많다. 심장과 눈에 주의하도록.
오래 병상에 있는 사람은 좀 위험상태다.","모든 점에서 화려해지게 되기 쉬운 때라 잘 조절해야 한다. 새로운 일 단기적인 일, 부분적인 일이라면 이익이 생기는 때다. 이 경우 영구적인 일을 착수하는 것은 당분간 중지하는 편이 좋다.","부분적으로는 결말이 난다. 계약서, 수표, 인감등의 착오가 일어나지 않게 주의하도록.
또 서류에는 복사가 필요한 때다. 그러나 문화적, 정신적인 면에 관한 교섭은, 이익은 적더라도 사회적으로 봐서 성공의 기회를 잡을 수 있다.","대체로 빠르면 발견되어 되돌아온다. 도난을 당한 물건은 경찰을 거쳐서 돌아온다. 밖에서 잃었던 물건은 남의 손에 이미 가 있다.","여행은 학교의 소풍, 또는 사적인 견락에는 좋을 것이다.
집은 너무 움직이지 않는 편이 좋을 것이다. 그러나 학생이나 아파트생활의 사람에게는 좋은 아파트가 발견된다.","어느 것을 택하면 좋을지 이리저리 생각을 하며 마음을 정하지 못하고 있는 때다.
목전의 사소한 것은 달성한다. 대강 마음이 일정치 않아 여러것에 눈이 쏠리고 있다.","학교, 문화방면, 예술면에는 가장 알맞는다.","합격된다. 단 재시험을 받는 수도 있다. 이 때에는 학력보다도 건강에 주의하도록.","메마른 날씨다. 계속 하늘이 개인다고 봐도 좋을 것이다. 때로는 비가 내리지 않고 물이 마른다. 비가 내리고 있을 때 이 괘가 나온다면 곧 비는 수그리고 개인 날씨가 된다.","이위화(離爲火)","30"
"[함]이란 느낌, 감응한다는 말이다. 
마음의 교류가 없이는 인간의 사회생활이 성립되지 않는다.그 사회의 최소단위는 마음이 서로 일치하는 부부가 그 전형이다. 이 괘의 상괘는 젊은 여자, 하괘는 젊은 남자를 의미하고 여자의 발밑에 남자가 무을 꿇고 사랑을 구하는 형상이다. 젊은 남녀는 마음이 통하게 되면 곧 사랑의 불꽃을 이르킨다. 가장 감응되기 쉬운 점에서 이 괘에 의해 감응의 원리를 나타내는 것이다. [함]의 원리는 부부로부터 사회전반, 나아가서는 천지 우주에까지 적용할 수가 있는 것이다.

[함]이란 느끼는 것.
유(부드러운)의 괘가 위에, 강(강한)의 괘가 아래에 있다. 음양의 두 기가 교감해서 친밀히 돕는다. 남자가 아래에 있어서 변함 없는 사랑을 맹세하고 여자도 그것을 기꺼이 받아들인다. 고로 굳은 결합을 계속한다면 발전하고 번영해서 만사가 순조롭다. 결혼에 길하다.
천지는 교감하여 만물을 생성하고 성인은 인심을 감화하여 천하를 평화롭게 한다. 감응의 이치를 알게 되면 천지만물의 마음을 다 알 수 있게된다.","산위에 연못이 있어서 축축이 적셔주고 있다. 이것이 [함]의 괘상이다. 군자는 이 괘상을 보고 마음을 비게 하여 사람들의 마음을 받아들인다.","[함]은 사물을 민감하게 느끼는 것을 의미한다. 그것은 어디까지나 옳은 것을 받아들이고 행위해도 좋다고 하는 것이다. 젊은 남녀가 옳은 결혼을 하여 자손을 낳아서 번영해 가는 것처럼 또 젊은 여성이 자기의 남편만을 의지하여 조금도 다른 남자에게 마음을 쓰지 않는다. 진실로 서로가 생각해 주고 사랑스럽게 느끼는 것이 [함]이다.","[함]은 마음에 느끼는 것 뿐만 아니라 관능이라든지 관각이라든가 하는 모든 감각을 말한다. 
운수는 좋은 때니까, 이유나 이론을 집어치우고 직감에 호소하여 민감하게 행동하면 효과는 올라간다. 첫 인상에서 좋다고 느낀 일에는 반드시 성공할 것이다. 이 괘는 인간의 감정이라든지 감각이란 의마가 있기 때문에 이 괘가 나올 경우에는 우선 연애문제가 일어나기 쉬운 때이다.
대인관계에선 물질면에 너무 중점을 두지 말고 정신면에서의 교분을 중요시 해 간다면 당신은 보다 행운으로 이끌 것이다.","일상의 일에는 부자유를 안느낀다. 그러나 당신의 노력 여하에 따라 수입은 급격히 커진다.","이것은 연애의 괘다. 특히 젊은 사람들끼리의 연애에 이 괘가 나올 때는 최상이다. 이러한 때는 한시 바삐 결혼을 하여 새 가정을 만들어야 한다.
당신이 남성이라면 정열파이고, 여성이라면 순정파다. 이 마음을 소중이 여겨, 장래 행복의 기초를 만들고 언제까지나 낭만적인 꿈의 세계를 잊어선 안된다.","좋은 점이다. 남성이 양자든가 아내의 가정에서 동거하는 것은 특히 좋은 의미가 있다. 이 괘가 나올 경우는 거의 당사자끼리 연애관계에 빠져 있을 때다.","전염병이 많은 때다. 섹스에 원인을 가진 병, 성병, 그 밖에 감기, 마진, 호홉기질환, 티부스. 임신 때문에 일어나는 병 등이다.","회사의 내부가 협력일치하여, 발전 향상의 기회가 가까와져 있는 때다. 상대를 신용하여 속히 방침과 계획을 세워 착수할 때다. 헤맨다든지 주저하고 있으면 모처럼의 기회를 놓지고 만다. 대단히 만사에 세심한 활동가가 입사하는 수가 있다. 또 훌륭한 아이디어맨을 만나는 때다.","상대와 일의 성질에 따라 다소는 다르지만, 뜻밖에 빨리 결말이 나고 또 유리한 조건으로 해결하는 수가 많은 때다. 모두 온순하고 부드러운 태도 및 정열로 힘차게 나간다면 기쁜 소식이 얻어진다. 먼 곳에 있는 상대와의 교섭, 거래는 좋은 결말을 본다. 빨리 서둘러야 한다.","물건 속에 있다. 가정 내에선 다락안이나 옷 속이나 이불속에서 찾아 낼 수 있다. 또 큰 물건이라면 어딘가에 숨겨져 있는 때다. 찾아낼 수 있다.","즐거운 기분을 맛보는 좋은 여행이다. 
이사는 적당한 곳이 곧 발견됨으로 좋은 때다. 또 집을 새로 짓는데에도 좋은 시기다.","태만하게 기다리지 말고 빨리 실행해야 할 때다. 속도가 중요하다.","빠르면 결정이 된다. 늦어서 남이 앞지르기전에 남이 손을 쓰지 못 하도록 해야 한다.","문과계통이 좋은 때다. 당사자의 실력에 응하여 지망학교도 다르다. 당신이 생각하고 있는 방향으로 가도록.","계속되는 개인 날씨에 때에 따라 약간의 비가 내리는 정도다. 비가 내리다가 곧 개는 날씨다. 대략 흐린 날씨가 많고. 비가와도 오래가지는 않는다. 여름은 소나기가 많이 온다.","택산함(澤山咸)","31"
"연애 뒤에는 결혼이다.
[항]이란 항상 불변하고 안정된 결혼 생활을 의미한다. 상괘는 성인이 된 남자, 하괘는 성인이 된 여자를 나타낸다. [함]의 괘에서는 젊었던 두 사람도 지금은 중년이 되고 위치도 남자가 위에 서고 여자는 아래에서 순종하는 것이다. 이전의 불타는 듯한 사랑도 편온한 생활로 변하여 있다. 그렇게 되면 또 파란을 구하는 마음이 동한다. 소위 마음이 들뜨는 상태가 일어난다. 위험한 유혹을 물리치지 않으면 항구한 길을 얻을 수 없다. 지금은 부부간에 한하지 않고 무슨 일에나 처음 가졌던 뜻을 잊지 않고 신기한 것에 현혹되는 일 없이 계속해서 일관된 방침을 밀고 나가는 것이 중요할 때이다.

항은 항구를 의미한다. 
강(남자)은 위에 있고 유(여자)는 아래에 있다. 우뢰와 바람이 힘을 합쳐서 만물의 생육을 돕고 아내는 순종하고 남편은 일한다. 각 효가 모두 음양이 서로 호응하고 있는 것이 [항]이다. 참으로 항구 불변하는, 안정된 모습니다. 그래서 만사가 형통하여 번영한다, 탈이 없다. 일관해서 도를 지키는 자는 순조로울 것이다. 천지의 도도 항구불변해서 그치는 일이 없다. 하나가 끝나면 하나가 시작된다. 이 끊임 없는 변화의 과정에 따라가는 자는 만사가 순조롭다.
일월(日月)은 하늘의 움직임에 따름으로서 영원히 비칠 수가 있는 것이다. 사철은 각각 변화에 의해서 영원히 순환할 수가 있다. 성인이 이 도를 계속 지키므로서 천하는 감화되고 육성되는 것이다. 변화속에야 말로 항구(恒久)가 있는 것이다. 이 항구란 것은 다 볼 수가 있다면 천지만물의 참된 모습을 알 수가 있는 것이다.","뇌성(雷聲)과 바람이 결합되는 것, 이것이 [항]의 괘상이다. 군자는 이 괘상을 보고 자기의 입장을 확정시켜 방침을 바꾸지 않는다.","[항]은 [늘 있음] 또는 [항상]이라는 뜻이다.
부부가 부부의 형태를 옳게 지키고 있으면 무사평온한 것과 같이 일상의 생활도 함부로 방침을 변하지 않는 편이 평화로운 나날을 보낼 수 있게 된다.","[항]은 늘 그대로, 당연하다고 하는 것이다. 항상은 늘 있는 모습, 항심은 늘 변하지 않는 마음등. 언제나 같은 상태를 보전해가는 말이다. 이 괘는 늘 현상 유지가 필요한 때다. 인간은 당연한 일상생활을 지속시키는데 만족하지 못하고, 늘 마음 속에서 무엇인가 좋은 수가 있지는 않을까? 하는 욕망을 가지기 쉬운 존재다. 그리고 평범한 행복을 잊어버리기 쉽게 되는 것이다. 이 [항]은 우리들이 매일 반복하여 일상의 생활을 지속시키는 것에 의해 생활의 안정을 얻게 됨을 뜻한다.
그 때문에 지금까지 해 왔던 것을 견실하게 지키는 때다. 꾸준히 인내심있게 노력하여 다른 곳에 마음을 움직이지 않는것, 또 이유없이 방침을 변동하지 않는 것, 달콤한 꿈을 꾸지 않는 것이 중요하다. 
또 이 괘는 부부의 일상생활이라 하는 의미를 가지며 중년부부의 안정된 마음과 생활면의 모습을 의미하고 있다.","일상의 금전은 풍부한 때다.장사에 있어서 실익이 생기는 때다.","서로 무리가 안 가는 연애이어서 생각보다는 오래 계속하는 연애다. 대체로 이 괘가 나올 때에는 상당히 오래 계속한 교제라 봐도 좋은 것이다.","결말을 지울 때까지 대단히 힘이 들겠지만, 결말이 나면 좋은 연분이다. 그러나 이 괘는 이미 내연관계의 경우가 많고 부부의 형태를 취하고 있다. 또 첩의 경우에도 정식 부부의 생활상태로 꾸며가는 사람이 많은 때다.","암계통, 식도람, 위암, 장암이 많은 때다. 오랜 불규칙한 생활을 원인으로 해서 허리가 쑤시고 척주가 삐뚤어지는 등, 만성병 때문에 요양이 오래 가는 떄다.","현상 유지다. 확장이나 새로운 계획은 좋지 않다. 그러나 남성은 자주 의욕이 밖으로 향하여 움직이는 때다.","평소관계가 있는 거래의 교섭이라면, 그대로 계속해도 좋다. 지금으로부터 새로 거래하는 것, 대규모적인 것이라면 당신이 장기적으로 노력하면 좋을 것이다. 성공한다면 큰 이익이 생긴다. 서둘고 덤비면 실패한다.","집안에서의 분실물은 물건 사이에 끼어 있다. 밖에서의 분실물은 이미 남이 줏어갔다.","특별한 볼일이 없는 한 나가지 않는 편이 좋을 것이다. 그러나 때로는 일상의 평범한 생활에 싫증이 나서 섹스를 위한 여행에 유혹되는 때다.","자기의 희망 목적에 대하여 오래도록 노력을 계속해 나가면 달성이 된다. 바쁘게 서둔다고 되는 것도 아니다.","이 괘는 현재가 안정되어 있기 때문에 현상유지의 괘다.","자기의 실력에 따른 곳이라면 좋을 것이다. 각자에게 개인 차가 있기 때문에 당사자의 실력여하에 따라 목적을 성취하는 것이다.","대체로 개인 날씨다. 흐려 있어도 비는 내리지 않는다. 여름은 우뢰와 함께 큰 비가 온다. 가을은 푸른 하늘이라고 봐도 좋을 것이다.","뇌풍항(雷風恒)","32"
"송 나라의 대학자 주희가 천자의 국사였을 때 권력을 쥔 한차주의 횡포를 규탄하는 상소문을 제출하려고 했던 일이 있다. 그것을 안 제자들이 스승의 위험을 걱정해서 말렸으나 듣지 않으며 마침내 점을 쳐서 결정하기로 했다. 그 때 나온 괘가 이 [돈]이었다. 주희는 묵묵히 물러나 상소문을 태워 없애고 은퇴하였다 한다. [돈]이란 피해서 물러 난다는 것. 또 돼지와도 통한다. 돼지는 도망하기 잘하는 동물이다. 나의 운기가 쇠해서 시류에 맞지 않을 때는 재빨리 물러나는 것이 최상의 방도다. 괘의 형상은 음의 세력이 일어나고 위에 있는 양이 물러나는 것을 나타낸다. 무리하게 뚫고 나가려 하지 말고 쇠운이 지나가는 것을 기다려야 한다.

[돈]의 괘는 피해서 숨어 살어야 길이 열린다는 것을 보이고 있다. 강(강한)효가 정중의 위치에 자리잡고 유(부드러운)효와 상응하고 있는 것은 시세에 따라 행동 할 것을 나타내고 있다. 소인의 세력이 점차로 커져가고 있는 세상이다. 일을 해도 순조롭지가 않다. [돈]의 의의는 참으로 중대하다.","하늘에 대하여 아래로부터 산이 솟아 오르려는 괘상이다. 군자는 이 괘상을 보고 증오하지 않고 엄격하게 소인을 멀리한다.","[돈]이란 피해서 물러난다는 괘이다.
시기적으로 나쁘고 운이 막혔을 때는 일시 물러나서 다음 기회를 노리고 은신해 있는 편이 낫다는 것이다.","[돈]이란 피해서 물러난다는 뜻이기 때문에 시기적으로 완전히 후퇴할 때이다. 마음이 들떠 있어서 함부로 나아가려는 성급함이 생기기 쉬운데, 운세가 쇠하여 있어서 이로움이 하나도 없다. 모든 일에서 일시적으로 손을 떼는 편이좋다. 아무리 미련이 있는 문제라도 용단을 내려 손을 뗄것. 그 편이 손해가 덜하다. 뜬 소문에 귀를 기울지 말것. 되도록이면 일을 수습해서 현상을 유지하도록 애써여 한다. 믿고 의지하던 사람과 헤여져서 큰 손해를 볼 때다.
옛 사람들은 우물을 파도 물이 없을 때라고 말했다. 재산을 물려받아 여유가 생기는 상속인들은 그 재산으로 세상을 피해 은둔생활의 즐거움을 맛 볼 때이다.","주위와 환경이 쓸쓸한 때이다. 필요에 쫓겨 돈은 쓸 데가 많지만 수입은 없고 돈을 빌리기도 힘들 때이다.","일시적으로 놀기 위한 상대로는 좋으나 그 이상의 관계는 좋지 않다. 데이트 같은 일에 공연한 돈의 낭비가 많을 때이다.","성사되지 않는다. 이쪽에서 꿀리는 형편이다. 만일 결혼을 한다해도 남자측이 손해보는 괘다.","체력이 소모될 때이므로 오랜 만성병을 갖고 있는 사람, 또는 현재 중병을 앓고 있는 사람은 주의해야 한다. 특히 냉병같은 증세, 치질, 성병에 주의해야 한다.","안이 비여 있을 때이다. 욕심을 내서 큰 점포 같은 것을 내지 말고 적은 점포에서 알차게 움직여야 한다. 그러나 이 괘는 사람의 낭비를 부채질하기 때문에 영화관이나 연극, 쇼, 빠, 카바레, 요정같은 업종은 큰 성황을 이룬다.","잘 진전되지 않는다. 무슨 일이나 불리한 입장에 놓인다. 자기편에서 스스로 나아가지 않아야 한다.","잃어버린 장소에서 멀리 사라졌기 때문에 손에 돌아오지는 않는다. 또한 집에서 없어진 물건은 집안 사람이 들고 나간 것이다.","클럽을 지어서 등산을 하거나 골프여행같은 것은 좋은 때이다. 사냥에도 좋을 때다. 그러나 돌풍같은 것에 주의하다.","지금은 이루어지지 않는다. 오히려 욕심을 내다가는 큰 재난이나 큰 손해를 입을 때다.","유흥업이나 음식업, 여행관계의 직장을 구해 볼 것","호텔 양성학교, 예능 계통의 학교, 배우학원 같은 곳에 입학하면 좋을 것이다.","잔뜩 흐려서 맑지가 않다. 봄 가을은 바람이 셀 것이다.","천산돈(天山돈)","33"
